"campus","unidade","shortcode","data","legenda","link","img_url","dia_semana","mes","tipo"
"Itapetinga","ifbaiano_itapetinga","DVD5W1XjRTu","22/02/2026 00:00","""... Adicionais ​WhatsApp: (77) 99969-7107. ​Instagram: @ifbaiano_itapetinga. ​E-mail: partiuif@reitoria.ifbaiano.edu.br. ​Site Oficial: concurso.ifbaiano.edu.br.""","https://www.instagram.com/p/DVD5W1XjRTu/","","6","2","Post"
"Itapetinga","ifbaiano_itapetinga","?__d=1Soul%E7%94%B7%E5%8F%B7%E6%89%B9%E5%8F%91%E5%95%86%E5%9F%8E%E2%9C%94%EF%B8%8F%2Bweixinle.com%2B%E2%AD%90%2B%2B%E7%9A%87%E5%86%A0%E7%AD%89%E7%BA%A79%E4%B8%BAQQ%E5%8F%B7%E5%87%BA%E6%B5%B7%E7%A5%9E%E5%99%A8","11/06/2026 15:40","""10K followers · 737 posts · Instituto Federal de Educação, Ciência e Tecnologia Baiano - Campus Itapetinga. Ensino Pesquisa Extensão.""","https://www.instagram.com/ifbaiano_itapetinga/reels/?__d=1Soul%E7%94%B7%E5%8F%B7%E6%89%B9%E5%8F%91%E5%95%86%E5%9F%8E%E2%9C%94%EF%B8%8F%2Bweixinle.com%2B%E2%AD%90%2B%2B%E7%9A%87%E5%86%A0%E7%AD%89%E7%BA%A79%E4%B8%BAQQ%E5%8F%B7%E5%87%BA%E6%B5%B7%E7%A5%9E%E5%99%A8","","3","6","Reel"
"Itapetinga","ifbaiano_itapetinga","DY7Buiwxrlq","29/05/2026 00:00","""Did you know there is a commission within IF Baiano dedicated to listening to the community, evaluating the institution, and proposing ...""","https://www.instagram.com/reel/DY7Buiwxrlq/","","4","5","Reel"
"Itapetinga","ifbaiano_itapetinga","DYALW0CjlYN","12/05/2026 15:40","""ATENÇÃO: CATAPORA (VARICELA) Informações e cuidados para a comunidade escolar A catapora é uma doença contagiosa comum na infância, ...""","https://www.instagram.com/p/DYALW0CjlYN/","","1","5","Post"
"Itapetinga","ifbaiano_itapetinga","?hl=zh-cn","15/06/2026 17:02","""Que honra participar do sábado letivo no @ifbaiano_itapetinga, hoje, compartilhando conhecimento com os alunos do 3º ano do Ensino Médio! ✨ Enemzeiro, você ...""","https://www.instagram.com/ifbaiano_itapetinga/reels/?hl=zh-cn","","0","6","Reel"
"Itapetinga","ifbaiano_itapetinga","?__d=1%E5%9B%9B%E9%80%9A%E4%B8%80%E8%BE%BE%E6%9F%A5%E8%AF%A2%E6%9F%A5%E8%AF%A2%E7%A7%BB%E5%8A%A8%E8%81%94%E9%80%9A%E7%94%B5%E4%BF%A1%E6%9C%BA%E4%B8%BB%E5%AE%9E%E5%90%8D%E4%BF%A1%E6%81%AF%E3%80%82%E6%9C%89%E5%94%AE%E5%90%8E%E7%9A%84%E7%8B%97%E7%8B%97%E5%85%8D%E8%B4%B9%E7%A4%BE%E5%B7%A52025%E7%A4%BE%E5%B7%A5%E5%BA%93%E6%9C%80%E6%96%B0%E6%95%B0%E6%8D%AE%E5%9C%A8%E7%BA%BF%E6%9F%A5%E8%AF%A2%E7%BD%91%E7%AB%99%E2%9C%94%EF%B8%8Fb5a06.com","18/06/2026 14:51","""10K followers · 744 posts · Instituto Federal de Educação, Ciência e Tecnologia Baiano - Campus Itapetinga. Ensino Pesquisa Extensão.""","https://www.instagram.com/ifbaiano_itapetinga/reels/?__d=1%E5%9B%9B%E9%80%9A%E4%B8%80%E8%BE%BE%E6%9F%A5%E8%AF%A2%E6%9F%A5%E8%AF%A2%E7%A7%BB%E5%8A%A8%E8%81%94%E9%80%9A%E7%94%B5%E4%BF%A1%E6%9C%BA%E4%B8%BB%E5%AE%9E%E5%90%8D%E4%BF%A1%E6%81%AF%E3%80%82%E6%9C%89%E5%94%AE%E5%90%8E%E7%9A%84%E7%8B%97%E7%8B%97%E5%85%8D%E8%B4%B9%E7%A4%BE%E5%B7%A52025%E7%A4%BE%E5%B7%A5%E5%BA%93%E6%9C%80%E6%96%B0%E6%95%B0%E6%8D%AE%E5%9C%A8%E7%BA%BF%E6%9F%A5%E8%AF%A2%E7%BD%91%E7%AB%99%E2%9C%94%EF%B8%8Fb5a06.com","","3","6","Reel"
"Itapetinga","ifbaiano_itapetinga","DYxEE4vRj5L","25/05/2026 00:00","""ifbaiano_itapetinga. ✨ Aqui, o futuro ganha oportunidades reais! No IF Baiano – Campus Itapetinga, a formação vai muito além da sala de aula.""","https://www.instagram.com/p/DYxEE4vRj5L/","","0","5","Post"
